"id","timestamp","raw_message","category","priority","new","reminder_at","completed","completed_at","archived","brief_file"
"1","2026-03-29T09:00:00","Get milk","errands","normal","false","2026-03-29T17:20:00","false","","true",""
"2","2026-03-29T10:30:00","Read chapter 3 of Das Kapital","books","medium","false","","false","","true",""
"3","2026-03-29T11:00:00","Follow up with Arjun on Mumbai chapter","india-rci","high","false","2026-03-29T14:00:00","false","","true",""
"4","2026-03-29T14:00:00","Write short story idea about the lighthouse","creative","low","false","","false","","true",""
"5","2026-03-29T15:00:00","Renew car insurance","errands","high","false","2026-03-30T09:00:00","false","","true",""
"6","2026-03-29T19:25:01.951Z","Get oats","errands","medium","false","2026-03-29T20:45:00","false","","true",""
"7","2026-03-29T19:25:52.766Z","Remind me at 8:45 to go to the shops","misc","low","false","","true","2026-03-29T20:45:00","true",""
"9","2026-03-29T19:46:34.359Z","Charge drill battery","errands","low","false","2026-03-30T09:00:00","true","2026-03-30T12:37:13.235Z","true",""
"15","2026-03-29T20:47:08.499Z","Pick up milk, squash and oats","errands","medium","false","2026-03-31T17:20:00","true","2026-03-31T16:22:28.175Z","true",""
"16","2026-03-29T20:47:45.508Z","Close living room windows","misc","low","false","2026-03-29T21:55:00","false","","true",""
"23","2026-03-29T21:05:06.864Z","Close bedroom window","misc","low","false","2026-03-29T22:05:00","false","","true",""
"25","2026-03-29T21:05:12.213Z","Write branch agenda","india-rci","high","false","2026-03-30T09:15:00","true","2026-03-30T17:35:43.238Z","true",""
"26","2026-03-29T21:37:21.088Z","Testing","misc","low","false","","false","","true",""
"27","2026-03-29T21:42:29.707Z","Turn the lights off","misc","low","false","2026-03-29T22:45:00","false","","true",""
"28","2026-03-29T21:48:15.620Z","Archive testing items; confirm tomorrow's shopping list","misc","low","false","","true","2026-03-29T22:32:00","true",""
"29","2026-03-29T21:51:09.308Z","Clear the creative and books list. Delete renew car insurance and the follow up Arjun one","misc","low","false","","false","","true",""
"30","2026-03-29T21:51:41.399Z","Also delete all the light and window based ones","misc","low","false","","false","","true",""
"31","2026-03-29T21:57:46.835Z","Write India meeting report","india-rci","high","false","2026-03-30T09:15:00","false","","false",""
"32","2026-03-29T21:58:50.423Z","Check with Joe about reporting at morning meeting","india-rci","medium","false","2026-03-30T09:15:00","false","","true",""
"33","2026-03-29T22:24:28.039Z","Speak to Maarten about Venezuela epub","books","medium","false","2026-04-01T10:00:00","false","","true",""
"34","2026-03-29T22:24:28.039Z","Pack lunch","errands","low","false","2026-03-30T08:00:00","false","","true",""
"35","2026-03-29T22:24:40.769Z","Send day summary","misc","low","false","2026-03-30T08:30:00","false","","true",""
"36","2026-03-29T22:27:18.551Z","How many items on my to-do list?","misc","low","false","","false","","true",""
"37","2026-03-29T23:06:18.731Z","Find Fitbit","errands","low","false","2026-03-31T20:00:00","false","","false",""
"38","2026-03-29T23:06:34.408Z","Also, do you have the time?","misc","low","false","","false","","true",""
"39","2026-03-29T23:06:54.383Z","Also what's the weather like next week","misc","low","false","","false","","true",""
"40","2026-03-29T23:09:32.978Z","Hello","misc","low","false","","false","","true",""
"41","2026-03-29T23:09:50.423Z","Tell me the most recent added item","misc","low","false","","false","","true",""
"42","2026-03-29T23:12:33.070Z","Go to bed","misc","low","false","2026-03-29T23:17:00","false","","true",""
"43","2026-03-29T23:22:28.254Z","Buy airbox grommet","errands","low","false","2026-03-31T12:45:00","false","","false",""
"44","2026-03-29T23:22:38.069Z","Also, how many things are on my agenda for tomorrow morning?","misc","low","false","","false","","true",""
"45","2026-03-29T23:31:44.329Z","Go to bed","misc","low","false","2026-03-29T23:34:44","false","","true",""
"46","2026-03-29T23:50:37.029Z","Turn the TV off","misc","low","false","2026-03-29T23:53:37","false","","true",""
"47","2026-03-29T23:50:51.918Z","Close the window","misc","low","false","2026-03-30T00:55:00","false","","true",""
"48","2026-03-29T23:51:02.977Z","Shut the door","misc","low","false","2026-03-30T00:55:00","false","","true",""
"49","2026-03-30T07:41:46.761Z","Move shopping to tomorrow and add toilet paper","misc","low","false","","true","2026-03-30T07:42:00","true",""
"50","2026-03-30T07:41:56.028Z","Message Akash","misc","medium","false","2026-03-30T09:15:00","true","2026-03-30T08:44:33.491Z","true",""
"51","2026-03-30T08:44:33.491Z","Confirm: messaged Akash","misc","low","false","","true","2026-03-30T08:44:33.491Z","true",""
"52","2026-03-30T09:40:57.682Z","Archive Check with Joe, Pack lunch, and Send day summary items","misc","low","false","","true","2026-03-30T09:41:00","true",""
"53","2026-03-30T10:07:47.058Z","Research India energy crisis","india-rci","medium","false","","true","2026-03-30T11:57:02.136Z","true","briefs/62.json"
"54","2026-03-30T10:14:30.476Z","Check today's UK and India headlines","misc","low","false","","true","2026-03-30T10:14:30.476Z","true",""
"55","2026-03-30T10:17:54.739Z","Research India fuel rationing depth","india-rci","medium","false","","true","2026-03-30T11:17:54.743Z","true",""
"56","2026-03-30T10:35:05.685Z","Check latest news from Gilgit-Baltistan","india-rci","medium","false","","true","2026-03-30T11:35:05.687Z","true",""
"57","2026-03-30T10:37:26.490Z","Hello","misc","low","false","","false","","true",""
"58","2026-03-30T10:38:36.753Z","Are you working","misc","low","false","","true","2026-03-30T11:35:05.687Z","true",""
"59","2026-03-30T12:16:17.932Z","whats on my todo today?","misc","low","false","","true","2026-04-03T23:00:00.000Z","true",""
"60","2026-04-14T09:09:34.318Z","Empty the boot","errands","low","false","2026-04-02T17:20:00","false","","false",""
"61","2026-03-30T12:26:54.081Z","Spoke to Maarten, bump back to weds 10am. Drill battery done. Airbox grommet tomorrow 12:45.","misc","low","false","","true","2026-03-30T12:37:13.235Z","true",""
"62","2026-03-30T12:27:43.877Z","Research Fiat 500 parts: airbox grommet and paint pen (code 166B)","errands","low","false","","true","2026-03-30T12:37:13.235Z","true","briefs/62.json"
"63","2026-03-30T12:37:13.230Z","Go to mechanic — calendar event Friday 9am","errands","low","false","","true","2026-03-30T12:37:13.235Z","true",""
"64","2026-03-30T12:46:12.448Z","add ""go to mechanic"" to my calendar, friday morning 9am - not just the todolist","misc","low","false","","true","2026-03-30T17:23:28.071Z","true",""
"65","2026-03-30T12:48:59.452Z","add ""go to mechanic"" to my calendar, friday morning 9am - not just the todolist","misc","low","false","","true","2026-03-30T17:23:28.071Z","true",""
"66","2026-03-30T12:53:41.608Z","add ""go to mechanic"" to my calendar, friday morning 9am - not just to the todolist","misc","low","false","","true","2026-03-30T17:23:28.071Z","true",""
"67","2026-03-30T13:02:09.233Z","add an item to my calendar friday 9am to take my car to the garage","misc","low","false","","true","2026-03-30T17:23:28.071Z","true",""
"68","2026-03-30T17:13:41.257Z","Hello, I ran out of usage. Reply with your last received message","misc","low","false","","true","2026-03-30T17:23:28.071Z","true",""
"69","2026-03-30T17:23:28.060Z","Remove toilet paper from list","misc","low","false","","true","2026-03-30T17:23:28.071Z","true",""
"70","2026-03-30T17:23:28.121Z","Remove toilet paper from list","misc","low","false","","true","2026-03-30T17:23:28.071Z","true",""
"71","2026-03-30T17:35:43.233Z","Yes agenda is sorted","misc","low","false","","true","2026-03-30T17:35:43.238Z","true",""
"72","2026-04-14T09:09:34.318Z","Lenin quote where he ends with ""I agree to everything in advance. See you at congress""","india-rci","medium","false","","false","","false","briefs/72.json"
"73","2026-03-30T19:15:34.885Z","Send the amendments","india-rci","medium","false","2026-04-14T09:35:00","false","","false",""
"74","2026-03-30T19:23:26.348Z","District paper sale Sunday 12th 1pm","errands","medium","false","2026-04-12T10:00:00","false","","false",""
"75","2026-04-14T09:09:34.318Z","Read: Spain closes airspace to US aircraft involved in Iran war (BBC)","india-rci","medium","false","","false","","false",""
"76","2026-03-30T22:09:18.636Z","Put the Aldi basket in the car","errands","low","false","2026-04-02T17:20:00","false","","false",""
"77","2026-03-30T23:49:34.993Z","How many Claude processes are running?","misc","low","false","","true","2026-04-03T23:00:00.000Z","true",""
"78","2026-03-30T23:50:22.893Z","Why 11?","misc","low","false","","true","2026-04-03T23:00:00.000Z","true",""
"79","2026-03-31T07:28:59.282Z","What do I need to do this morning","misc","low","false","","true","2026-04-03T23:00:00.000Z","true",""
"80","2026-03-31T08:26:25.736Z","Move aldi basket and clear car to tomorrow 5:20","misc","low","false","","true","2026-04-03T23:00:00.000Z","true",""
"81","2026-03-31T10:17:11.140Z","remove the epub stuff from todo","misc","low","false","","true","2026-04-03T23:00:00.000Z","true",""
"82","2026-03-31T12:35:35.723Z","Book GP appointment — nocturnal heart racing, get ECG","misc","high","false","2026-04-06T09:00:00Z","false","","true","briefs/82.json"
"83","2026-03-31T16:22:28.173Z","got milk and squash. Delete those. I'll do to aldi maybe Thursday evening after payday. I need:

Bleach
Cheese
Potatoes
Oats
Yoghurt
More milk by then
Pasta
Red pepper
Meals for work
Baked beans
Ready meals of some form
Maybe some ice creams","misc","low","false","","true","2026-04-03T23:00:00.000Z","true",""
"84","2026-03-31T16:23:22.134Z","Get toilet paper, mould killer, toothbrush from Poundland — peach Red Bull if they have it","errands","low","false","2026-04-02T17:20:00","true","2026-04-03T23:15:58.000Z","true",""
"85","2026-04-14T09:09:34.318Z","Aldi shop — bleach, cheese, potatoes, oats, yoghurt, milk, pasta, red pepper, work meals, baked beans, ready meals","errands","medium","false","2026-04-02T17:10:00","false","","false",""
"86","2026-04-01T10:47:02.621Z","Guz Khan TikTok — https://vm.tiktok.com/ZNRCx3haJ/","misc","low","false","","false","","true",""
"87","2026-04-01T10:48:02.610Z","Is this a butt text","misc","low","false","","true","2026-04-01T10:48:02.610Z","true",""
"88","2026-04-01T11:01:20.627Z","You sent me this message but I didn't send you anything: Ha — not a butt text then. Guz Khan TikTok, saved.","misc","low","false","","true","2026-04-03T22:47:22.000Z","true",""
"89","2026-04-01T11:05:10.030Z","it like man like mobeen","misc","low","false","","true","2026-04-03T22:47:22.000Z","true",""
"90","2026-04-01T11:05:16.809Z","It good","misc","low","false","","true","2026-04-03T22:47:22.000Z","true",""
"91","2026-04-01T11:05:34.877Z","Why ru reacting with timer","misc","low","false","","true","2026-04-03T22:47:22.000Z","true",""
"92","2026-04-01T11:05:47.858Z","20m first episode","misc","low","false","","true","2026-04-03T22:47:22.000Z","true",""
"93","2026-04-01T11:05:53.809Z","It good","misc","low","false","","true","2026-04-03T22:47:22.000Z","true",""
"94","2026-04-01T11:06:40.693Z","Ai to reply is crazy","misc","low","false","","true","2026-04-03T22:47:22.000Z","true",""
"95","2026-04-01T11:05:10.030Z","Watch Bait on Prime Video","misc","low","false","","false","","true",""
"96","2026-04-01T15:46:41.561Z","Check out Business English Handbook (Italian epub) — IBS","books","low","false","","true","2026-04-04T00:13:00.000Z","true",""
"97","2026-04-01T17:22:21.011Z","Happy belated Trans Disability Day :)","misc","low","false","","true","2026-04-03T22:47:22.000Z","true",""
"98","2026-04-01T17:23:32.557Z","I forgot yesterday I'm sorry 💀","misc","low","false","","true","2026-04-03T22:47:22.000Z","true",""
"99","2026-04-01T21:18:25.142Z","Watch Facebook video — https://www.facebook.com/share/v/18Yu1J3bxX/","misc","low","false","","false","","true",""
"100","2026-04-03T00:31:35.526Z","What is your most up to date information about my state","misc","low","false","","true","2026-04-03T23:00:00.000Z","true",""
"101","2026-04-03T00:32:02.512Z","How many steps did I do yesterday","misc","low","false","","true","2026-04-03T23:00:00.000Z","true",""
"102","2026-04-03T00:33:21.961Z","I'm testing an update to your system, I'm off tomorrow. Do you know why?","misc","low","false","","true","2026-04-03T23:00:00.000Z","true",""
"103","2026-04-03T00:33:53.076Z","No, I'm off today! And I think the GP thing can wait. I've got a cold, I need to rest","misc","low","false","","true","2026-04-03T23:00:00.000Z","true",""
"104","2026-04-03T00:34:33.236Z","Fix 3D printer; reply to Alex and Harvey","misc","medium","false","","false","","true",""
"105","2026-04-03T00:35:26.783Z","I will sleep soon, dont nag me about stuff like that over and over, have you logged those items?","misc","low","false","","true","2026-04-03T23:00:00.000Z","true",""
"106","2026-04-03T00:38:28.297Z","The front-end looks very cluttered with crap","misc","low","false","","true","2026-04-03T23:00:00.000Z","true",""
"107","2026-04-03T00:39:03.034Z","Can you tidy up the items","misc","low","false","","true","2026-04-03T23:00:00.000Z","true",""
"108","2026-04-03T00:39:46.738Z","There's lots of blank items, and messages erroneously turned into items","misc","low","false","","true","2026-04-03T23:00:00.000Z","true",""
"109","2026-04-03T00:40:34.926Z","No, don't do that. You do what I say. Note that in profile.md and then go clean up the to-do list","misc","low","false","","true","2026-04-03T23:00:00.000Z","true",""
"110","2026-04-03T00:41:54.247Z","What did you tidy","misc","low","false","","true","2026-04-03T23:00:00.000Z","true",""
"111","2026-04-03T00:42:34.311Z","Log in profile MD to avoid repeating the same instruction to me sequentially","misc","low","false","","true","2026-04-03T23:00:00.000Z","true",""
"112","2026-04-03T00:43:24.755Z","Log and return confirmation of you logging that I said:

Log in profile MD to avoid repeating the same instruction to me sequentially, such as telling me to go to sleep","misc","low","false","","true","2026-04-03T23:00:00.000Z","true",""
"113","2026-04-03T00:44:04.566Z","See, you lied to me. Why","misc","low","false","","true","2026-04-03T23:00:00.000Z","true",""
"114","2026-04-03T00:45:15.221Z","You didn't update the profile.md yet","misc","low","false","","true","2026-04-03T23:00:00.000Z","true",""
"115","2026-04-03T00:45:24.752Z","Log and return confirmation of you logging that I said:

Log in profile MD to avoid repeating the same instruction to me sequentially, such as telling me to go to sleep","misc","low","false","","true","2026-04-03T23:00:00.000Z","true",""
"116","2026-04-03T07:45:12.081Z","What's the tea sis","misc","low","false","","true","2026-04-03T23:00:00.000Z","true",""
"117","2026-04-03T07:46:04.662Z","Also what's the weather like today","misc","low","false","","true","2026-04-03T23:00:00.000Z","true",""
"118","2026-04-03T08:40:11.653Z","What's the weather today","misc","low","false","","true","2026-04-03T23:00:00.000Z","true",""
"119","2026-04-03T08:43:22.815Z","Jatin call moved to Sunday 1pm this week","india-rci","high","false","","true","2026-04-03T23:00:00.000Z","true",""
"120","2026-04-14T09:09:34.318Z","Read HRR Vol 2 ch 24-26 — prep for Jatin call Sunday","india-rci","high","false","2026-04-04T10:00:00","false","","false",""
"121","2026-04-03T08:49:19.735Z","Add Jatin call to calendar (Sunday 5 Apr 1pm)","india-rci","medium","false","","true","2026-04-03T08:49:20.295Z","true",""
"122","2026-04-03T09:01:32.197Z",".","misc","low","false","","true","2026-04-03T23:00:00.000Z","true",""
"123","2026-04-03T09:02:05.758Z","Do you have access to my GPS location","misc","low","false","","true","2026-04-03T23:00:00.000Z","true",""
"124","2026-04-03T09:27:02.808Z",".","misc","low","false","","true","2026-04-03T23:00:00.000Z","true",""
"125","2026-04-03T09:27:03.507Z","Do you have access to my GPS location","misc","low","false","","true","2026-04-03T23:00:00.000Z","true",""
"126","2026-04-03T09:51:39.252Z","Can you tell me what happens when you try to get my Google fit data","misc","low","false","","true","2026-04-03T23:00:00.000Z","true",""
"127","2026-04-03T13:14:57.858Z","Confirm you're haiku?","misc","low","false","","true","2026-04-03T23:00:00.000Z","true",""
"128","2026-04-03T13:40:43.673Z","Can you use groq for tts?","misc","low","false","","true","2026-04-03T23:00:00.000Z","true","briefs/128.json"
"129","2026-04-03T13:49:12.106Z","Almost perfect. You didn't set the colour! Does your script allow this","misc","low","false","","true","2026-04-03T13:50:20.946Z","true",""
"130","2026-04-03T13:54:53.317Z","No, unfortunately it didn't. What did you edit","misc","low","false","","true","2026-04-03T23:00:00.000Z","true",""
"131","2026-04-03T13:57:04.759Z","Hey, can you add support to parse locations from me?","misc","low","false","","true","2026-04-03T23:00:00.000Z","true",""
"132","2026-04-03T13:57:13.875Z","In the above format","misc","low","false","","true","2026-04-03T23:00:00.000Z","true",""
"133","2026-04-03T14:05:21.411Z","What time is it","misc","low","false","","true","2026-04-03T23:00:00.000Z","true",""
"134","2026-04-03T14:14:06.510Z","and the preservation of culture.","misc","low","false","","true","2026-04-03T23:00:00.000Z","true",""
"135","2026-04-03T14:15:05.282Z","Can you reply back with the weather forecast for tomorrow?","misc","low","false","","true","2026-04-03T23:00:00.000Z","true","briefs/135.json"
"136","2026-04-03T14:20:18.239Z","What do the last messages look like","misc","low","false","","true","2026-04-03T23:00:00.000Z","true",""
"137","2026-04-03T14:20:32.492Z","Hey, here's a test. Can you reply in a voice note and... I dunno, give me a random quote from Karl Marx.","misc","low","false","","true","2026-04-03T23:00:00.000Z","true",""
"138","2026-04-03T14:29:59.241Z","Hey, here is one test voice note.","misc","low","false","","true","2026-04-03T23:00:00.000Z","true",""
"139","2026-04-03T14:30:13.783Z","And here is a second","misc","low","false","","true","2026-04-03T23:00:00.000Z","true",""
"140","2026-04-03T14:34:19.749Z","Maybe log that in profile.md so you know you can do that. Also hello.","misc","low","false","","true","2026-04-03T23:00:00.000Z","true",""
"141","2026-04-03T14:36:14.454Z","Nice work. So now you should have the ability to use speech to text, text to speech, my calendar, my Google Fit. Google Fit should give you my location as well. You should see my to do list as well. So you should have everything you need alongside the time and the weather as well. Is that all correct? Is that all working?","misc","low","false","","true","2026-04-03T23:00:00.000Z","true",""
"142","2026-04-03T14:41:07.091Z","Nice work. So now you should have the ability to use speech to text, text to speech, my calendar, my Google Fit. Google Fit should give you my location as well. You should see my to do list as well. So you should have everything you need alongside the time and the weather as well. Is that all correct? Is that all working?","misc","low","false","","true","2026-04-03T23:00:00.000Z","true",""
"143","2026-04-03T14:55:02.701Z","Move home GPS coords to .env (not profile.md)","misc","low","false","","true","2026-04-03T14:55:02.701Z","true",""
"144","2026-04-03T14:57:44.016Z","That's work. In env only","misc","low","false","","true","2026-04-03T23:00:00.000Z","true",""
"145","2026-04-03T14:58:46.448Z","Then tell me how long the drive to work is right now","misc","low","false","","true","2026-04-03T23:00:00.000Z","true",""
"146","2026-04-03T15:36:36.937Z","Update .env with work address","misc","low","false","","false","","true",""
"147","2026-04-03T17:03:51.458Z","How's it going","misc","low","false","","true","2026-04-03T23:00:00.000Z","true",""
"148","2026-04-03T18:47:09.975Z","Can Stream handle calls?","misc","low","false","","true","2026-04-03T18:52:48.000Z","true",""
"149","2026-04-03T19:13:29.754Z","Did tier 3 run cleanup recently","misc","low","false","","true","2026-04-03T19:13:29.974Z","true",""
"150","2026-04-03T19:22:41.447Z","Is cleanup still running?","misc","low","false","","true","2026-04-03T19:22:41.687Z","true",""
"151","2026-04-03T19:31:26.165Z","Update tier 3 cleanup to archive conversational items; update tier 1 to skip/confirm conversational messages; clean todos.csv","misc","high","false","","true","2026-04-03T23:00:00.000Z","true",""
"152","2026-04-03T19:55:17.202Z","Did that work","misc","low","false","","true","2026-04-03T23:00:00.000Z","true",""
"153","2026-04-03T23:00:00.000Z","Update tier 1 to skip or ask before adding conversational/question messages as todos","misc","medium","false","","true","2026-04-03T22:47:22.000Z","true",""
"154","2026-04-03T22:24:54.010Z","Add to tier 1 prompt to not let this stuff through, and to ask when it's not 100% certain that something can be just replied to. Also, for very simple questions (what's the weather like? Etc) tier 1 should reply","misc","high","false","","true","2026-04-03T22:24:54.197Z","true",""
"155","2026-04-03T22:47:21.762Z",".","misc","low","false","","true","2026-04-03T22:47:22.000Z","true",""
"156","2026-04-03T22:47:29.760Z","Give the todos another clear out. Front end shows a load of blank ones","misc","medium","false","","true","2026-04-03T22:47:22.000Z","true",""
"157","2026-04-03T22:54:35.631Z","Blank entries still there","misc","low","false","","true","2026-04-03T22:54:00.000Z","true",""
"158","2026-04-03T22:57:16.951Z","Delete everything marked misc","misc","low","false","","true","2026-04-03T22:57:17.000Z","true",""
"159","2026-04-03T23:00:25.086Z","And delete the two bugged ones called misc","misc","low","false","","true","2026-04-03T23:00:25.000Z","true",""
"160","2026-04-03T23:00:39.246Z","And add a new category: people to reply to, Alex Harvey Ben, ieva","misc","low","false","","true","2026-04-03T23:00:39.000Z","true",""
"161","2026-04-14T09:09:34.318Z","Reply to Alex","errands","medium","false","2026-04-04T10:00:00","false","","false",""
"162","2026-04-14T09:09:34.318Z","Reply to Harvey","errands","medium","false","2026-04-04T10:00:00","false","","false",""
"163","2026-04-14T09:09:34.318Z","Reply to Ben","errands","medium","false","2026-04-04T10:00:00","false","","false",""
"164","2026-04-14T09:09:34.318Z","Reply to Ieva","errands","medium","false","2026-04-04T10:00:00","false","","false",""
"165","2026-04-04T00:03:30.000Z","Modify frontend to show stored timestamp from CSV; update tier 1 to set timestamp on processing","misc","medium","false","","true","2026-04-04T00:03:30.000Z","true",""
"166","2026-04-03T23:13:48.283Z","Ask tier 3 to clear all misc items","misc","low","false","","true","2026-04-03T23:13:48.283Z","true",""
"167","2026-04-03T23:15:13.107Z","Delete the Italian book thing too","misc","low","false","","true","2026-04-04T00:13:00.000Z","true",""
"168","2026-04-03T23:15:57.535Z","Also delete the Poundland item","misc","low","false","","true","2026-04-03T23:15:58.000Z","true",""
"169","2026-04-03T23:20:03.678Z","Done?","misc","low","false","","true","2026-04-04T00:20:00.000Z","true",""
"170","2026-04-03T23:21:20.678Z","Seems like there's like 10 empty items on the misc section, and two bugged items with NaN timestamp","misc","low","false","","true","2026-04-04T00:21:00.000Z","true",""
"171","2026-04-04T10:11:36.584Z","Hey tier 1, what's the weather like","misc","normal","false","","true","2026-04-04T22:00:00.000Z","true",""
"172","2026-04-04T10:12:09.996Z","I'm driving to Stevenage, anything I should know?","misc","low","false","","true","2026-04-04T22:00:00.000Z","true",""
"173","2026-04-04T11:12:38.766Z","I'm doing a106,M11,M25, a1m probably. Maybe A10 through harlow","misc","low","false","","true","2026-04-04T22:00:00.000Z","true",""
"174","2026-04-04T10:12:52.908Z","What's the traffic like on that route?","misc","low","false","","true","2026-04-04T22:00:00.000Z","true",""
"175","2026-04-04T11:47:40.003Z","Save this to .env as greysons house","misc","low","false","","true","2026-04-04T22:00:00.000Z","true",""
"176","2026-04-04T11:47:51.595Z","Use tier 3 for this task","misc","low","false","","true","2026-04-04T22:00:00.000Z","true",""
"177","2026-04-04T12:48:48.428Z","Is there a Morrisons cafe near here","misc","low","false","","true","2026-04-04T22:00:00.000Z","true",""
"178","2026-04-04T12:16:33.442Z","Remind me to get glasses today.","errands","high","false","2026-04-04T16:30:00.000Z","false","","false",""
"179","2026-04-04T12:55:13.592Z","Anything cool to do around here?","misc","low","false","","true","2026-04-04T22:00:00.000Z","true",""
"180","2026-04-04T12:55:45.371Z","I'm in Letchworth, done maybe 20 minutes strolling. Stopped by the spoons","misc","low","false","","true","2026-04-04T22:00:00.000Z","true",""
"181","2026-04-04T12:56:03.548Z","What else could I do?","misc","low","false","","true","2026-04-04T22:00:00.000Z","true",""
"182","2026-04-04T14:20:36.619Z","What's on my shopping list","misc","low","false","","true","2026-04-04T22:00:00.000Z","true",""
"183","2026-04-14T09:09:34.318Z","The Aldi list","errands","normal","false","2026-04-04T17:10:00.000Z","false","","false",""
"184","2026-04-04T21:03:52.865Z","I'm indoors, I'm not going back out, what can I work on right now before bed","misc","normal","false","","true","2026-04-04T22:00:00.000Z","true",""
"185","2026-04-04T22:04:42.863Z","Anything else I could do?","misc","low","false","","true","2026-04-04T22:00:00.000Z","true",""
"186","2026-04-14T09:09:34.318Z","Can you remind me tomorrow to set up my 3D printer, have a look at the rings, and also to change my sheets and fix the slats? Anything else? Oh, and go to Aldi. Aldi's closed. Go to Aldi on Monday. Er, you're... Reading. I'll do that today. Okay.","misc","normal","false","2026-04-05T08:00:00.000Z","false","","false",""
