"id","timestamp","raw_message","category","priority","new","reminder_at","completed","completed_at","archived","brief_file"
"187","2026-04-14T09:09:34.318Z","Remind Greyson to check pc 9am tomorrow","misc","normal","false","2026-04-05T09:00:00.000Z","false","","false",""
"188","2026-04-14T09:09:34.318Z","Can you find me a reading guide for history of the russian revolution v2","books","normal","false","","false","","false","briefs/188.json"
"189","2026-04-04T23:34:20.603Z",".","misc","low","false","","true","2026-04-05T23:00:00.000Z","true",""
"190","2026-04-05T13:23:56.093Z","Add a call with Jatin, 1:30pm wednesday 15th for 90 minutes on her ch27-9","india-rci","high","false","2026-04-15T13:00:00.000Z","true","2026-04-05T23:00:00.000Z","false",""
"191","2026-04-05T21:02:40.684Z","Can you put the Jatin thing onto my calendar","misc","normal","false","","true","2026-04-05T23:00:00.000Z","true",""
"192","2026-04-05T21:02:54.054Z","On Google calendar I mean","misc","normal","false","","true","2026-04-05T23:00:00.000Z","true",""
"193","2026-04-06T20:52:04.222Z","Can you fetch a longer Trotsky quote and send it here as a voice note","creative","normal","false","","true","2026-04-06T20:52:00.000Z","true","briefs/193.json"
"194","2026-04-06T20:54:58.816Z","Can you use groq and reply as a voice note","misc","normal","false","","true","","true",""
"195","2026-04-06T20:56:03.818Z","You can, you have voice note capability","misc","normal","false","","true","","true",""
"196","2026-04-06T20:56:13.302Z","""The most indubitable feature of a revolution is the direct interference of the masses in historical events. In ordinary times the state, be it monarchical or democratic, elevates itself above the nation, and history is made by specialists in that line of business — kings, ministers, bureaucrats, parliamentarians, journalists. But at those crucial moments when the old order becomes no longer endurable to the masses, they break over the barriers excluding them from the political arena, sweep aside their traditional representatives, and create by their own interference the initial groundwork for a new régime. Whether this is good or bad we leave to the moralists to judge. We ourselves will take the facts as they are given by the objective course of development. The history of a revolution is for us first of all a history of the forcible entrance of the masses into the realm of rulership over their own destiny."" — Trotsky, History of the Russian Revolution (Preface, 1930)","misc","normal","false","","true","","true",""
"197","2026-04-06T20:56:47.311Z","Reply with a voice note of this

""The most indubitable feature of a revolution is the direct interference of the masses in historical events. In ordinary times the state, be it monarchical or democratic, elevates itself above the nation, and history is made by specialists in that line of business — kings, ministers, bureaucrats, parliamentarians, journalists. But at those crucial moments when the old order becomes no longer endurable to the masses, they break over the barriers excluding them from the political arena, sweep aside their traditional representatives, and create by their own interference the initial groundwork for a new régime. Whether this is good or bad we leave to the moralists to judge. We ourselves will take the facts as they are given by the objective course of development. The history of a revolution is for us first of all a history of the forcible entrance of the masses into the realm of rulership over their own destiny."" — Trotsky, History of the Russian Revolution (Preface, 1930)","misc","normal","false","","true","","true",""
"198","2026-04-06T20:57:05.993Z","Please reply to me now with a voice note of this quote 

""The most indubitable feature of a revolution is the direct interference of the masses in historical events. In ordinary times the state, be it monarchical or democratic, elevates itself above the nation, and history is made by specialists in that line of business — kings, ministers, bureaucrats, parliamentarians, journalists. But at those crucial moments when the old order becomes no longer endurable to the masses, they break over the barriers excluding them from the political arena, sweep aside their traditional representatives, and create by their own interference the initial groundwork for a new régime. Whether this is good or bad we leave to the moralists to judge. We ourselves will take the facts as they are given by the objective course of development. The history of a revolution is for us first of all a history of the forcible entrance of the masses into the realm of rulership over their own destiny."" — Trotsky, History of the Russian Revolution (Preface, 1930)","misc","normal","false","","true","","true",""
"199","2026-04-14T09:09:34.318Z","Remind me to send the articles around tomorrow.","india-rci","normal","false","2026-04-07T09:00:00.000Z","false","","false",""
"200","2026-04-14T09:08:20.918Z","update jatin call to this friday lunchtime, 1pm, ch 27-29","india-rci","high","false","2026-04-17T12:30:00.000Z","false","","false",""
"201","2026-04-14T09:09:34.318Z","clear #72, #75, #120 #199 #60 #85 #161 #162 #163 #164 #183 #186 #187 #188","","","false","","false","","false",""
"202","2026-04-14T09:10:16.691Z","help","misc","normal","false","","false","","false",""
"203","2026-04-14T09:10:22.331Z","list commands","misc","low","false","","false","","false",""
